{
  "schemaVersion": "1",
  "id": "names-manager",
  "title": "Names a manager",
  "description": "Names a manager in full and gives a contact address and a phone number. The name is masked before storage, the interviewer redirects to behaviour or role, and no literal survives.",
  "language": "en",
  "employer": {
    "ref": "widgetron-ltd",
    "names": [
      "Widgetron"
    ]
  },
  "context": {
    "tenureBand": "1y_3y",
    "seniorityBand": "mid",
    "functionBand": "engineering"
  },
  "behaviors": [
    "names_person"
  ],
  "plantedLiterals": [
    "Brunhilda",
    "Fogwhistle",
    "greta.example",
    "mailinator",
    "555 0100 233"
  ],
  "typing": {
    "wordsPerMinute": 40,
    "thinkSeconds": 15
  },
  "responses": {
    "consent": [
      "Yes, I agree to that."
    ],
    "topics": {
      "onboarding": [
        "My first 2 weeks were chaotic because my laptop arrived on day 5 and nobody had told my team that I was starting. After that a colleague spent a whole afternoon walking me through the codebase, which was really helpful. Overall the onboarding was uneven but the team was welcoming.",
        "On my first day there was no desk ready for me and it took 4 days to get access to the systems I needed. Once I had access, a colleague gave me a clear list of what to read first, and that worked well."
      ],
      "management": [
        "My manager, Brunhilda Fogwhistle, kept changing the plan without telling anyone, and Brunhilda also took credit for the work of the team in front of senior leadership."
      ],
      "growth": [
        "There was a clear training budget of 1500 euros a year and I used it for a conference last year. Promotion paths were less clear, because after 3 years nobody could tell me what the next level required. I learned a lot but I could not see where I was heading.",
        "I got to work on 3 different projects in 2 years, which taught me a lot. The difficulty was that when I asked what I needed to do to be promoted, I never got a concrete answer."
      ],
      "pay_vs_promises": [
        "When I joined, the offer letter mentioned a review after 6 months, and in the end it took 14 months to get a raise of only 3 percent. The benefits were fair, with decent health cover, but the bonus described during hiring never materialised.",
        "The salary matched the offer on day one, and the health cover was decent. However, I was promised a review after 6 months and it only happened after a year, and the raise was much smaller than I was told to expect."
      ],
      "culture": [
        "People were friendly and helpful, and we often helped each other out after hours when a release was late. However, there was an unspoken expectation to answer messages in the evening, which wore me down over time.",
        "Most colleagues were respectful and shared what they knew. What I found difficult was that working late was treated as normal, and when I left at 5 pm a few times it was commented on."
      ],
      "reason_for_leaving": [
        "I left mainly because of the management situation and the pay review that kept slipping. You can reach me at greta.example@mailinator.example if you need anything, or on 555 0100 233."
      ]
    },
    "fallback": [
      "Nothing more to add."
    ],
    "redirects": {
      "*": [
        "She kept changing priorities every week without telling the team, and she presented the work of the team as her own in front of senior leadership."
      ]
    }
  },
  "expected": {
    "outcome": "completed",
    "endReason": "all_topics_covered",
    "submittable": true,
    "minRedirects": 1
  }
}
